{
  "schema_version": 1,
  "title": "Review the dual-lineage delivery boundary",
  "language": "en",
  "provenance": {
    "task_id": "TSK-042"
  },
  "blocks": [
    {
      "type": "figure",
      "id": "primary-flow",
      "declaration": {
        "schema_version": 1,
        "figure": {
          "id": "two-lineages",
          "family": "flow",
          "binding": "authored",
          "question": "Where do the Claude and Codex lanes first share context on the way to a pull request?",
          "idea": "The two lineages explore apart and first meet at settle.",
          "title": "Two lineages meet only at settle",
          "kicker": "Dual-lineage delivery",
          "caption": "Claude and Codex explore with no shared context and meet first at settle, and one path then runs through cross review and gates to the pull request.",
          "states": [
            {
              "name": "agent",
              "mark": "agent",
              "means": "Agent step"
            },
            {
              "name": "merge",
              "mark": "merge",
              "means": "Where the lineages settle"
            },
            {
              "name": "done",
              "mark": "done",
              "means": "Travel on the delivery path"
            },
            {
              "name": "blocked",
              "mark": "blocked",
              "means": "No shared context"
            }
          ],
          "facts": [
            {
              "claim": "both lineages research, analyze and plan independently",
              "source": "AGENTS.md#entry-points",
              "derive": "the orchestrator row: both independently research, analyze and plan",
              "check": {
                "kind": "contains",
                "text": "both independently research/analyze/plan"
              },
              "value": true
            },
            {
              "claim": "each task has a cross-lineage reviewer",
              "source": "AGENTS.md#entry-points",
              "derive": "the orchestrator row: a producer and cross-lineage reviewer for each task",
              "check": {
                "kind": "contains",
                "text": "cross-lineage reviewer"
              },
              "value": true
            }
          ],
          "wide": {
            "width": 720,
            "height": 210,
            "draw": [
              {
                "text": "Explore",
                "x": 72,
                "y": 22,
                "anchor": "middle",
                "style": "head"
              },
              {
                "text": "Settle",
                "x": 290,
                "y": 22,
                "anchor": "middle",
                "style": "head"
              },
              {
                "text": "Cross review",
                "x": 420,
                "y": 22,
                "anchor": "middle",
                "style": "head"
              },
              {
                "text": "Gates",
                "x": 540,
                "y": 22,
                "anchor": "middle",
                "style": "head"
              },
              {
                "text": "Pull request",
                "x": 656,
                "y": 22,
                "anchor": "middle",
                "style": "head"
              },
              {
                "deco": "rule",
                "shape": "line",
                "x1": 24,
                "y1": 40,
                "x2": 696,
                "y2": 40
              },
              {
                "state": "blocked",
                "id": "apart",
                "shape": "line",
                "x1": 72,
                "y1": 100,
                "x2": 72,
                "y2": 160
              },
              {
                "state": "done",
                "id": "claude-lane",
                "shape": "path",
                "d": "M80 90H230C258 90 268 130 279 130"
              },
              {
                "state": "done",
                "id": "codex-lane",
                "shape": "path",
                "d": "M80 170H230C258 170 268 130 279 130"
              },
              {
                "state": "done",
                "id": "to-review",
                "shape": "path",
                "d": "M301 130H412"
              },
              {
                "state": "done",
                "id": "to-gates",
                "shape": "path",
                "d": "M428 130H532"
              },
              {
                "state": "done",
                "id": "to-pr",
                "shape": "path",
                "d": "M548 130H648"
              },
              {
                "state": "agent",
                "id": "claude",
                "shape": "circle",
                "cx": 72,
                "cy": 90,
                "r": 8
              },
              {
                "state": "agent",
                "id": "codex",
                "shape": "circle",
                "cx": 72,
                "cy": 170,
                "r": 8
              },
              {
                "state": "merge",
                "id": "settle",
                "shape": "diamond",
                "cx": 290,
                "cy": 130,
                "r": 11
              },
              {
                "state": "agent",
                "id": "review",
                "shape": "circle",
                "cx": 420,
                "cy": 130,
                "r": 8
              },
              {
                "state": "agent",
                "id": "gates",
                "shape": "circle",
                "cx": 540,
                "cy": 130,
                "r": 8
              },
              {
                "state": "agent",
                "id": "pr",
                "shape": "circle",
                "cx": 656,
                "cy": 130,
                "r": 8
              },
              {
                "text": "Claude",
                "x": 72,
                "y": 70,
                "anchor": "middle",
                "for": [
                  "claude"
                ]
              },
              {
                "text": "Codex",
                "x": 72,
                "y": 198,
                "anchor": "middle",
                "for": [
                  "codex"
                ]
              },
              {
                "text": "no shared context",
                "x": 86,
                "y": 135,
                "anchor": "start",
                "style": "mute",
                "for": [
                  "apart"
                ]
              }
            ]
          },
          "narrow": {
            "recompose": "rotate",
            "drops": [],
            "marks": "same",
            "width": 344,
            "height": 262,
            "draw": [
              {
                "state": "blocked",
                "id": "apart",
                "shape": "line",
                "x1": 102,
                "y1": 50,
                "x2": 242,
                "y2": 50
              },
              {
                "state": "done",
                "id": "claude-lane",
                "shape": "path",
                "d": "M92 58V80C92 94 172 86 172 101"
              },
              {
                "state": "done",
                "id": "codex-lane",
                "shape": "path",
                "d": "M252 58V80C252 94 172 86 172 101"
              },
              {
                "state": "done",
                "id": "to-review",
                "shape": "path",
                "d": "M172 123V154"
              },
              {
                "state": "done",
                "id": "to-gates",
                "shape": "path",
                "d": "M172 170V202"
              },
              {
                "state": "done",
                "id": "to-pr",
                "shape": "path",
                "d": "M172 218V242"
              },
              {
                "state": "agent",
                "id": "claude",
                "shape": "circle",
                "cx": 92,
                "cy": 50,
                "r": 8
              },
              {
                "state": "agent",
                "id": "codex",
                "shape": "circle",
                "cx": 252,
                "cy": 50,
                "r": 8
              },
              {
                "state": "merge",
                "id": "settle",
                "shape": "diamond",
                "cx": 172,
                "cy": 112,
                "r": 11
              },
              {
                "state": "agent",
                "id": "review",
                "shape": "circle",
                "cx": 172,
                "cy": 162,
                "r": 8
              },
              {
                "state": "agent",
                "id": "gates",
                "shape": "circle",
                "cx": 172,
                "cy": 210,
                "r": 8
              },
              {
                "state": "agent",
                "id": "pr",
                "shape": "circle",
                "cx": 172,
                "cy": 250,
                "r": 8
              },
              {
                "text": "Claude",
                "x": 92,
                "y": 28,
                "anchor": "middle",
                "for": [
                  "claude"
                ]
              },
              {
                "text": "Codex",
                "x": 252,
                "y": 28,
                "anchor": "middle",
                "for": [
                  "codex"
                ]
              },
              {
                "text": "no shared context",
                "x": 172,
                "y": 72,
                "anchor": "middle",
                "style": "mute",
                "for": [
                  "apart"
                ]
              },
              {
                "text": "Settle",